,title,company,logo,industry,raw_description
35,Finance Development Program Internship Opportunities,Apple,https://media.licdn.com/dms/image/C560BAQHdAaarsO-eyA/company-logo_100_100/0/1595530301220/apple_logo?e=2147483647&v=beta&t=fzApiwhLe8glzMZp-97xBufiZCiswDRHyeTSds9N3l4,Computers and Electronics Manufacturing,"Summary

Imagine what you could do here. At Apple, new ideas have a way of becoming extraordinary products, services, and customer experiences very quickly. Bring passion and dedication to your job, and there's no telling what you could accomplish.


The people here at Apple don’t just build products — they create the kind of wonder that’s revolutionized entire industries. It’s the diversity of those people and their ideas that inspires the innovation that runs through everything we do, from amazing technology to industry-leading environmental efforts. Join Apple, and help us leave the world better than we found it.


Join the Apple Finance organization and make a positive impact on one of the most influential technology leaders in the industry. At Apple, you’ll share in a commitment to excellence by partnering with teams who are building innovative products that delight customers. We hire quality individuals with integrity, personal accountability, teamwork, excellence, and can-do thinking.


Apple has multiple internship opportunities for students who are passionate about pursuing careers in Finance. As an intern, you will learn, grow, and contribute to Apple’s business while working on exciting projects alongside top finance professionals.


We are looking for students with an interest in Corporate Finance or Accounting, as well as some of the following qualifications.




• Junior standing

• Excellent verbal and written communications skills

• Ability to think analytically

• Strong at multi-tasking

• Thrive in a fast paced environment

• Be a self-starter




Opportunities within Finance can include the following programs:


FINANCE DEVELOPMENT PROGRAM (FDP)


FDP interns have the opportunity to support a specific area of Apple’s business, such as:

AppleCare, Financial Services, Internet Software & Services, Marketing, Operations, R&D, Retail, Sales, Worldwide Financial Planning & Analysis, and more.


During the summer, you could:

• Analyze financial performance by highlighting trends and anomalies

• Streamline reporting through the use of databases such as Tableau or with Excel macros

• Partner with cross functional groups and business partners to analyze the business

• Provide insights and recommendations for operational improvements and innovations

• Assist with close procedures


After completing a summer internship, successful Finance interns will be eligible to potentially join Apple’s Finance Development Program (FDP). The FDP is a 15-18 month rotational program providing entry-level talent with an opportunity to gain breadth through typically six to eight diverse experiences in Apple Finance. Upon completion, FDPs move into non-rotating Financial Analyst roles within Apple.


PRODUCTION FINANCE DEVELOPMENT PROGRAM (PFDP)


PFDP interns have the opportunity to assist in financial oversight and management of an Original Content production. During the summer, you could:

• Assist with tracking and handling production budgets and schedules

• Perform day-to-day financial activities such as opening purchase orders, reviewing and processing invoices, auditing payroll, and preparing journal entries with supporting documentation

• Analyze and provide regular reporting on the production’s financial performance

• Manage materials and contracts related to the production such as insurance, labor laws, tax credits, rebates, refunds, royalties, etc.


After completing a summer internship, successful Production Finance interns will be eligible to potentially join Apple’s Production Finance Executive Development Program (PFDP). The PFDP is a two to three-year rotational program providing entry-level talent with an opportunity to gain breadth in Production Finance through four to six diverse experiences (i.e. feature, drama, comedy, unscripted, kids). Upon completion, PFDPs move into a non-rotating Jr. Executive Production Finance role.




Pursuing a Bachelors degree in Business Administration, Finance, Accounting, Economics, Math or related field. For the PFDP, experience or interest with music or film is preferred.


To express interest in any of our Finance teams, please provide a copy of your resume, cover letter and unofficial transcript.




Apple is an Equal Employment Opportunity Employer that is committed to inclusion and diversity. We also take affirmative action to offer employment and advancement opportunities to all applicants, including minorities, women, protected veterans and individuals with disabilities.


We will ensure that individuals with disabilities are provided reasonable accommodation to participate in the job application or interview process, to perform essential job functions, and to receive other benefits and privileges of employment. Please contact us to request accommodation.


Role Number: 200480000"
36,2024 L’Oréal USA HR Summer Internship - Undergraduate,L'Oréal,https://media.licdn.com/dms/image/D4E0BAQFEB_g-FWxSrQ/company-logo_100_100/0/1688397791729/loral_logo?e=2147483647&v=beta&t=lKQEwqBYoDqGWO_jflECj8qNnBmSoX0rVi4civT_d18,Personal Care Product Manufacturing and Manufacturing,"HR Summer Internship 2024

Location: New York, New York (Hudson Yards HQ)

­­Who We Are

For more than a century, L’Oréal has devoted its energy, innovation, and scientific excellence solely to one business: Beauty. Our goal is to offer each and every person around the world the best of beauty in terms of quality, efficacy, safety, sincerity and responsibility to satisfy all beauty needs and desires in their infinite diversity.

At L’Oréal, Human Resources is an incubator of talent where we find, recruit, and develop brilliant minds around the world. We provide expertise on topics like organizational effectiveness, employee engagement, pay, HR advice, learning & development, well-being, and talent acquisition among others. Come join our dynamic team and help us elevate the employee journey!






$22-$26.50

Being a member of the L’Oréal USA Summer Internship Program, you will feel empowered to contribute in tangible, meaningful ways from day one because too. As the #1 Beauty Tech company in the world with over 35 international brands – CeraVe, Kiehl’s, Maybelline, and Urban Decay to name just a few – we embrace in the workplace to lay the groundwork for you to be able to accomplish great things. You can explore our internship program and hear directly from our past interns at lorealoncampus.com.

Freedom to go beyond, that’s the beauty of L’Oréal - Are you ready?

We are an Equal Opportunity Employer and take pride in a diverse environment. We would love to find out more about you as a candidate and do not discriminate in recruitment, hiring, training, promotion, or other employment practices for reasons of race, color, religion, gender, sexual orientation, national origin, age, marital or veteran status, medical condition or disability, or any other legally protected status.

If you are a qualified individual with a disability or a disabled veteran, you may request a reasonable accommodation if you are unable or limited in your ability to access job openings or apply for a job on this site as a result of your disability. You can request reasonable accommodations by contacting USApplicationAccommodation@support.lorealusa.com. If you need assistance to accommodate a disability, you may request an accommodation at any time.

Our Safe Together Plan: Your safety is our highest priority. We will proceed with caution and adhere to enhanced protection standards to ensure our sites are safe for all employees. We must all operate with the shared responsibility for each other’s health & safety in mind.


LI_FRA"
37,Internship - Quantitative Strategist,Virtu Financial,https://media.licdn.com/dms/image/C4D0BAQF9hayRoH-r4A/company-logo_100_100/0/1551726686084?e=2147483647&v=beta&t=etLIGpTHXumL7dsPiCbzWWV52DSV2H8XS10NXBuQ6o4,Financial Services,"Virtu is an industry-leading financial technology firm that operates both proprietary trading and client-facing businesses in the global financial marketplace. Our cutting edge, proprietary technology is core to everything we do. We trade in over 35 countries, across 235 financial exchanges and over 25% of retail order flow in the US. is serviced by Virtu.

Our team is a dedicated group of traders, quants and developers that are inspired by the unique and exciting challenges we solve every day. Our culture combines the creativity of a fast paced start up, with the stability of a disciplined financial services firm. We are a flat organization and encourage our people to innovate and lean on their teammates for support and collaboration. We have fun, work hard and strive to be virtuous in all we do.



Virtu's internship program offers graduate students an extraordinary opportunity to learn about the firm and the world’s financial markets. We have built a thoughtful and challenging curriculum with projects that introduce students to the many complex and ever changing problems to solve. Students can expect a company-curated global training week for our interns, real quantitative problems to solve throughout the program and engaging social events to get to know our team and culture.



Our Quantitative Strategists and Researchers are an integral part of the algorithmic research team, working to improve Virtu's trading algorithms through transforming large data sets into usable trading models. Successful quantitative researchers work well independently and collaboratively, enjoy learning and applying new algorithmic techniques, and are excited to see their ideas turn into tangible results.

Interns will work directly with senior members of the team on our trading strategies used in Virtu's customer market making business. Interns in this track will apply their quantitative analysis and research skills to discover patterns that can potentially improve our trading algorithms. Through these projects, interns will learn about Virtu's market making business, learn to apply basic data analysis tools to large trading data sets and be pushed to think out of the box for trading ideas. Each intern will complete one to two projects which could come from different mentors and groups.







After applicants pass an initial resume screening, an online programming test will be sent via email. This test is from a service called Codility so please be on the lookout. After passing the programming test, we will contact you to arrange a phone screen. We are looking forward to meeting you!"
38,Barry Katz Entertainment Internship (Assistant to CEO),Barry Katz Entertainment,https://media.licdn.com/dms/image/C4D0BAQHwxxkqLuIhbQ/company-logo_100_100/0/1565829817321?e=2147483647&v=beta&t=6uqdiC-eRQJiYMUxxl5XERordrXV8XgAZGTZOq8jeO4,"Movies, Videos, and Sound","Job Description

Full & Part Time Unpaid Internship Opportunities
Physical/Post Production



Interns will work directly with the CEO of the company (Barry Katz) and his team of assistants to support BKE talent management and consulting clients, television/film productions, and on the Industry Standard podcast (guests have included Kevin Hart, Dr. Phil, Caitlyn Jenner, ""Wonder Woman"" director Patty Jenkins, David Copperfield, Judd Apatow, Norman Lear, Bill Burr, Chuck Lorre, and Netflix president Ted Sarandos). You are not required to have all of the skills listed below in all areas, but Barry does like to have most internships cross over into as many areas (from the list below) as possible.



We are looking for video/audio editors who will be responsible for producing BKE content.





Candidates must have or have access to a reliable computer capable of processing large files.



We are looking to hire Podcast interns who will help manage, produce, and edit (audio/video) podcast.





We are looking for detail-oriented administrative interns to help run daily office operations.





We are looking for motivated and comedy-oriented social media interns to create and maintain content across various social media platforms.





We are looking for motivated development interns with a passion for storytelling and developing written content."
39,Machine Learning Summer Internship,Morgan Stanley,https://media.licdn.com/dms/image/C560BAQFtDpMvYgbIwA/company-logo_100_100/0/1677778127603?e=2147483647&v=beta&t=SdRsFihBzKt42ljo1Whg7v4IX1WbxF3IdxqFO6zTMPw,"Financial Services, Investment Banking, and Investment Management","Education Level

Doctorate Degree

Business Unit

Technology



The Quantitative Technology Machine Learning Research Summer Internship is an intensive 10-week program that provides Summer Associates the opportunity to work alongside Full-Time Finance professionals and ML specialists on impactful applied research projects. Summer Associates will work within Morgan Stanley’s Machine Learning Research Team for the entirety of the program. This is a highly motivated and collaborative team of scientists, technologists, and market practitioners. This team is responsible for working with business units and technology teams across the entire Firm to solve mission-critical high impact problems. The multi-faceted program features senior quant teach-in sessions, divisional speaker series, networking events, and community service. With individual coaching and continuous feedback, the program enables Summer Associates to experience and understand what a long-term career in ML Research within the Firm entails.



The Summer kicks off with a week-long introductory training program, which provides an institutional contextualization to the work that Summer Associates will be doing through market-knowledge training, finance workshops, coding and product training. Following the training week, Summer Associates will continue to receive more individualized on-the-job training as they begin their daily work and projects. Summer Associates will have a direct manager, as well as a program mentor, both of whom will act as invaluable resources throughout their time at Morgan Stanley.









Expected base pay rates for the role will be between 170000 and 185000 per year at the commencement of employment. However, base pay if hired will be determined on an individualized basis and is only part of the total compensation package, which, depending on the position, may also include commission earnings, incentive compensation, discretionary bonuses, other short and long-term incentive packages, and other Morgan Stanley sponsored benefit programs



Sep 6, 2023



Americas-United States of America-New York-New York



Doctorate Degree



Management



Full Time



Associate"
40,Events (Front-of-House) Internship,Museum of the Bible,https://media.licdn.com/dms/image/D4E0BAQHlE0-9HlPMsA/company-logo_100_100/0/1666106430099?e=2147483647&v=beta&t=rW_xlJ5vSo2WQZZ04ZTFW4a9up21HiyvFdek3zIcWUw,"Museums, Historical Sites, and Zoos","Events (Front of House) Internship (Spring 2024 Semester)

Date Posted: October 3rd, 2023

Application Deadline: December 8th, 2023

Events Intern

Intern - Unpaid

Allison Houck, Events Manager

Under the supervision of the Events Manager, interns will learn basic to intermediate skills that will equip them for event coordination and front of house management in a theater environment.


Learning opportunities will include:

Liaising between stage management and box office

Interacting with clients, guests, and museum staff

Seating a theater in a safe and expeditious manner

Understanding ADA seating requirements, accommodations, and accessibility standards

Managing a large and varied pool of volunteer ushers

Navigating and utilizing ticketing software (Tessitura)

Undergraduate or graduate student. Must currently be enrolled in or a recent graduate from a college or university.

Must be enrolled in a major or minor program in theater or theater production, events management, communications, or related field. A cover letter is required to be submitted with this application.

Supporting staff with the daily operations of the department

Assisting with live performances, films, and other theater uses within a larger museum context

Greeting and seating patrons in a safe and timely manner

Problem solving guest concerns

Maintaining proper appearance and integrity of the event and theater spaces

Assisting with planning and coordinating logistics for events and successful day of event execution

Passionate about the Bible and will champion our mission to invite all people to engage with the transformative power of the Bible


Must be able to lift up to 20 lbs.

Must work well in a fast-paced environment

Must strictly adhere to scheduled call times

Availability on weekends and evenings"
41,Design Internship,Fortnight Collective,https://media.licdn.com/dms/image/C560BAQFrhyXeyYcofA/company-logo_100_100/0/1643236282220?e=2147483647&v=beta&t=MOuG4doq-doYxbW-aAu44Eyc7TZ6K1puHShk4nvbAt4,Advertising Services,"Department: Creative

Employment Type: Internship

Location: Boulder, CO

$16.00 - $18.00 / hour


FC Design Interns are thinkers, makers, and visual storytellers.

TIME FRAME

20 hours per week

Sep 5, 2023- Dec 22, 2023"
42,Continuous Improvement Intern,MillerKnoll,https://media.licdn.com/dms/image/C4E0BAQFE4ARy_JL6og/company-logo_100_100/0/1626812994363?e=2147483647&v=beta&t=STEA7HOpNJXpLZtOSaK4NArIczL1VDGeo0gYY2cRjk0,Design Services,"MillerKnoll Summer Internship Program is a paid opportunity that allows you to gain real-world experience and cultivate your professional skills. Besides the work you’ll do within your field of study, you'll participate in one-on-one meetings with mentors, a summer-long project, learning sessions with senior leaders, and much more.



MillerKnoll’s Summer Internship Program is a paid, 12-week opportunity that provides a 100% real-world experience for students early in their careers. Throughout the summer you will apply academic learning to real-world situations and cultivate leadership, problem-solving, and communication skills.

As a Continuous Improvement Intern you work on Change Point Management which entails learning how set up and/or refining a model area at GSO to visualize and manage the communication of changes that are planed and unplaned. Also, the creation of Lounge post covering different topics of MKPS and interview of team members.



You'll have opportunities to speak up, solve problems, influence others, and be an owner every day as you...





The needed skills and experience for this role include...





Our values speak to our shared beliefs. They describe how we live our purpose through the way we lead, the way we see one another, and the way we approach our work.

reflects our commitments to creating places that matter, to being a good neighbor in our communities, and to using business as a force for good.

is our statement about the worth of individuals and our commitment to helping everyone reach their full potential.

demonstrates how challenging one another, making room for everyone, and working and winning as one makes us stronger.



Simply put, we hire everyone. MillerKnoll is comprised of people of all abilities, gender identities and expressions, ages, ethnicities, sexual orientations, veterans from every branch of military service, and more. Here, you can bring your whole self to work. We’re committed to equal opportunity employment, including veterans and people with disabilities.

This organization participates in E-Verify Employment Eligibility Verification."
43,"Internship, Business Analyst, North America Used Cars (Winter/Spring 2024)",Tesla,https://media.licdn.com/dms/image/C4D0BAQHUcu98SZ2TVw/company-logo_100_100/0/1607665771371?e=2147483647&v=beta&t=Mnz7U8K9cFj61WrtbTmRiiLt1Qf2FnIEpuj7qkL-jmQ,"Renewable Energy Semiconductor Manufacturing, Motor Vehicle Manufacturing, and Utilities","What To Expect
Disclaimer: This position is expected to start around January or February 2024 and continue through the entire Spring term (i.e. through May 2024) or intoSpring/Summer 2024if available. We ask for a minimum of 12 weeks, full-time and on-site, for most internships. Please consider before submitting an application.

International Students: If your work authorization is through CPT, please consult your school on your ability to work 40 hours per week before applying.You must be able to work 40 hours per week on-site.Many students will be limited to part-time during the academic year.

Internship Program at Tesla

The Internship Recruiting Team is driven by the passion to recognize and develop emerging talent. Our year-round program places the best students in positions where they will grow technically, professionally, and personally through their experience working closely with their Manager, Mentor, and team. We are dedicated to providing an experience that allows the intern to experience life at Tesla by including them in projects that are critical to their team’s success.

Tesla is seeking a motivated Business Analyst to support high-impact and strategic initiatives across all aspects of used cars in North America, including trade-in, inspection, quality, wholesale, pricing, sales, customer support, and unit economics. In this role you will work cross-functionally with stakeholders in multiple departments including IT Applications, Logistics, Sales, Delivery, and Finance.









As a full-time Tesla Intern, you will be eligible for:


Expected Compensation

$24.04 - $33.65/hour + benefits

Pay offered may vary depending on multiple individualized factors, including market location, job-related knowledge, skills, and experience. The total compensation package for this position may also include other elements dependent on the position offered. Details of participation in these benefit plans will be provided if an employee receives an offer of employment."
44,MHUSA 2024 Diversity Summer Internship Program - Marketing,Moët Hennessy,https://media.licdn.com/dms/image/C560BAQEvYWILo11_Xw/company-logo_100_100/0/1625239234740/moethennessy_logo?e=2147483647&v=beta&t=qXqpeCjTke9OIuoWQRCRZbxgCPBYM5tMuLDRRz4FPXA,Beverage Manufacturing,"MISSION STATEMENT

Moët Hennessy, the Wines and Spirits Division of LVMH, regroups twenty-five Maisons, many of which have been around for centuries, while others are just starting their journey. Our vision is to lead the future of luxury Wines and Spirits from nature to communities.

Located in the most prestigious terroirs around the world, we have unique savoir-faire from winemaking to art de vivre, hospitality, and brick-and-clicks retail management to craft exceptional experiences for consumers. For many years, with the ambition to pass on a better world to future generations, we have been committed to the Living Soils Living Together program structured around four key commitments: Regenerating our Soils, Mitigating our Climate Impact, Engaging society, and Empowering our People.

Moët Hennessy is proud to promote a diverse, equitable and inclusive working environment for all. As an employer, Moët Hennessy offers unique journeys throughout its global ecosystem, opportunities to develop new skills and grow professionally.



As part of our We Are One Inclusion, Diversity & Equity (IDE) strategy, Moët Hennessy is on a mission to build an equitable and inclusive workplace where everyone feels respected, seen, heard, and valued for their unique contributions to our business and culture. We strive to embody an ethos of awareness, drive innovation, and deepen the cultural connections that reflect our business and our portfolio. A core pillar of our IDE strategy is centered on the principle that people make the difference and is essential to the success of our business. The Pathways internship program at Moët Hennessy is a testament to our intention and investment around creating a pipeline of diverse leaders, and we invite you to be a part of our legacy as we lead the way in redefining the luxury of our future.

As an intern with Moët Hennessy USA, you'll gain a strong understanding of the various business groups and the multitude of components supporting them. The Summer internship will run from May - August 2024. Along with hands-on experience, direct interaction with cross functional teams and project-based assignments you'll have an opportunity to receive mentorship from Moët Hennessy USA leaders, networking opportunities, and exposure to stakeholders across the entire company.

You'll also get a chance to make lasting impressions through collaboration with your respective team and colleagues on deliverables and strategic business initiatives. Whether your role is assisting on a new brand marketing campaign, a social media strategy or supporting the commercial organization, you’ll gain professional practical experience applicable to your future trajectory.










External applicants must be currently authorized to work in the United States on a full-time basis.

Moët Hennessy USA, Inc. is an equal opportunity/affirmative action employer. Moët Hennessy USA, Inc. considers candidates without regard to race, color, religion, gender, gender identity, sexual orientation, national origin, age, disability, veteran status, or any other characteristic protected by applicable law."
